id,business_type,category_name,google_category_id,product_name,price_cents,brand,description,sku_pattern,generation_source,usage_count,quality_score,created_at,last_used_at,image_url,thumbnail_url,image_width,image_height,image_bytes,enhanced_description,features,specifications,has_image,image_quality
sid-sxsbgy5c,pet_supplies,Dog Food & Treats,tid-c2r2kf8v_dog-food-treats,"Pawsitively Gourmet Beef & Sweet Potato Stew, 12 Pack (13.2 oz cans)",2399,Pawsitively Gourmet,"Savory beef and sweet potato stew in a hearty gravy, perfect for any dog.",PG-BSP12-013,ai,1,0,2025-12-23 22:41:09.978,,https://nbwsiobosqawrugnqddo.supabase.co/storage/v1/object/public/photos/tid-c2r2kf8v/products/sid-mvj7g713/original-1766529790615.jpg,https://nbwsiobosqawrugnqddo.supabase.co/storage/v1/object/public/photos/tid-c2r2kf8v/products/sid-mvj7g713/thumb-1766529790615.jpg,1024,1024,147083,"Indulge your dog with the rich flavors of Pawsitively Gourmet Beef & Sweet Potato Stew. This case of 12 cans, each containing 13.2 ounces of gourmet stew, is crafted with high-quality beef, sweet potatoes, and a savory gravy that dogs absolutely love. It's more than just tasty; it's nutritious, containing all the essential vitamins and minerals needed to maintain your pet's health. Perfect for dogs of all breeds and sizes, this stew promotes healthy digestion while providing a deliciously satisfying meal. Whether used as a tasty topper for dry food or a special standalone treat, it's sure to please even the pickiest of palates.","[""High-quality beef as the primary ingredient"", ""Rich in essential vitamins and minerals"", ""No artificial flavors or preservatives""]","{""size"": ""13.2 oz"", ""quantity"": ""12 Cans"", ""ingredients"": [""Beef"", ""Sweet Potato"", ""Vitamins"", ""Minerals"", ""Gravy""]}",t,standard
sid-q4fkcyif,pharmacy,Personal Care,tid-c2r2kf8v_personal-care,"Neutrogena Hydro Boost Water Gel, 50g",1999,Neutrogena,A hydrating water-gel moisturizer that provides intense hydration for supple and smooth skin.,NGHBWG-050,ai,2,0,2025-12-22 21:21:26.595,2026-04-02 07:22:22.947,https://nbwsiobosqawrugnqddo.supabase.co/storage/v1/object/public/photos/tid-c2r2kf8v/products/sid-yawb6e5h/original-1766438595493.jpg,https://nbwsiobosqawrugnqddo.supabase.co/storage/v1/object/public/photos/tid-c2r2kf8v/products/sid-yawb6e5h/thumb-1766438595493.jpg,1024,1024,89040,"Introducing Neutrogena Hydro Boost Water Gel for those seeking a moisturizer that provides intense hydration without leaving skin feeling oily or heavy. This 50g jar contains a unique water gel formula that absorbs quickly, like a gel, but has the long-lasting, intense moisturizing power of a cream. It's designed to help quench thirsty skin by boosting skin's hydration level and locking it in all day, leaving skin feeling supple and hydrated. This oil-free formula contains hyaluronic acid, a hydrator found naturally in the skin, which attracts moisture and locks it in. Neutrogena Hydro Boost Water Gel is non-comedogenic, so it won't clog pores. It's the perfect moisturizer for all skin types, transforming your skin care routine into a refreshing experience.","[""Hydrates skin with the power of hyaluronic acid"", ""Oil-free and non-comedogenic"", ""Quick-absorbing water gel formula"", ""Keeps skin hydrated all day"", ""Suitable for all skin types""]","{""size"": ""50g"", ""quantity"": ""1"", ""ingredients"": [""Water"", ""Dimethicone"", ""Glycerin"", ""Dimethicone/Vinyl Dimethicone Crosspolymer"", ""Phenoxyethanol"", ""Hyaluronic Acid""], ""package_dimensions"": ""2.9 x 2.9 x 4.0 inches""}",t,standard
i-yywmo30l,hardware_tools,Office Supplies,t-v84j50g0_office-supplies,"Sharpie Permanent Markers, Fine Point, Black, 12 Count",999,Sharpie,"Sharpie Permanent Markers feature a fine point tip for precise writing and vibrant, waterproof, fade-proof black ink.",SPM-12BLK-999,ai,1,0,2025-12-07 13:53:28.159,,,,,,,"Experience the bold, smooth, high-quality writing of Sharpie Permanent Markers, perfect for the office, classroom, or home. These fine point markers deliver precise lines for clean writing and are ideal for labeling, drawing, and writing on most surfaces. The waterproof, fade-proof, and smear-proof black ink ensures your projects stay pristine, without smudging or fading over time. With Sharpie Permanent Markers, your creativity knows no bounds. The pack of 12 black markers ensures you'll always have one on hand when inspiration strikes. Whether you're a professional looking for reliable tools for your workspace, or a student aiming for the best in your projects, Sharpie offers the performance you can trust.","[""Fine point tip for precise, clean lines"", ""Waterproof, fade-proof, and smear-proof ink for long-lasting marks"", ""Quick-drying ink to prevent smudging"", ""Durable, long-lasting design for extended use"", ""Pack of 12 markers ensures ample supply for all your writing needs""]","{""tipType"": ""Fine"", ""inkColor"": ""Black"", ""quantity"": 12, ""fadeProof"": true, ""smearProof"": true, ""waterproof"": true}",f,
i-03i1e57u,hardware_tools,Home & Garden,t-v84j50g0_home-garden,Gardena Comfort Bypass Pruning Shears,3499,Gardena,"Ergonomic pruning shears designed for cutting flowers, young shoots, and fresh wood up to 24mm in diameter.",GDN-5524BS,ai,1,0,2025-12-07 13:52:37.315,,https://nbwsiobosqawrugnqddo.supabase.co/storage/v1/object/public/photos/t-v84j50g0/products/i-0bnzfk5l/original-1765115620755.jpg,https://nbwsiobosqawrugnqddo.supabase.co/storage/v1/object/public/photos/t-v84j50g0/products/i-0bnzfk5l/thumb-1765115620755.jpg,1024,1024,116853,"Introducing the Gardena Comfort Bypass Pruning Shears, the perfect tool for gardeners looking to make precise cuts without compromising on comfort. Engineered with high-quality materials, these pruning shears feature a bypass cutting system that makes clean cuts on fresh wood, ensuring healthy plant growth. The ergonomic handle with soft components offers a non-slip grip, reducing hand fatigue during extended use. Whether you're pruning flowers, young shoots, or fresh branches, these shears provide unmatched precision and ease. With an integrated spring mechanism and a practical single-hand lock, the Gardena Comfort Bypass Pruning Shears are not only efficient but also safe to use and store.","[""Ergonomic handle with soft components for a comfortable, non-slip grip"", ""Bypass cutting system for clean cuts on fresh wood"", ""Integrated spring mechanism for easy use"", ""Single-hand safety lock for secure storage"", ""Cuts branches up to 24mm in diameter""]","{""weight"": ""255g"", ""blade material"": ""Stainless steel"", ""lock mechanism"": ""Single-hand safety lock"", ""handle material"": ""Plastic with soft components"", ""cutting diameter"": ""24mm""}",t,standard
i-9n9mdl4m,hardware_tools,Books & Media,t-v84j50g0_books-media,The Complete Guide to Home Repair & Improvement,2999,Creative Homeowner,This comprehensive book provides detailed information on home repair and improvement.,CH-9781580117838,ai,1,0,2025-12-07 13:53:18.585,,https://nbwsiobosqawrugnqddo.supabase.co/storage/v1/object/public/photos/t-v84j50g0/products/i-0frlnkjo/original-1765115688368.jpg,https://nbwsiobosqawrugnqddo.supabase.co/storage/v1/object/public/photos/t-v84j50g0/products/i-0frlnkjo/thumb-1765115688368.jpg,1024,1024,137368,"Transform your space with 'The Complete Guide to Home Repair & Improvement' from Creative Homeowner. This essential guide is packed with over 300 projects and thousands of instructional photographs, providing homeowners with the knowledge they need to tackle any project with confidence. From basic repairs to major renovations, this book covers it all, offering easy-to-follow instructions that ensure professional results. Whether you're a novice or a seasoned DIYer, this guide will become your go-to resource for every home improvement project.","[""Includes over 300 projects for a wide range of home improvements."", ""Features thousands of step-by-step photographs for clear guidance."", ""Covers essential tools and materials needed for each project."", ""Provides tips and tricks to achieve professional results."", ""Suitable for both beginners and experienced DIY enthusiasts.""]","{""ISBN"": ""978-1580117838"", ""size"": ""8.5 x 11 inches"", ""cover"": ""Hardcover"", ""pages"": ""600"", ""publisher"": ""Creative Homeowner""}",t,standard
i-4dj6kzxj,hardware_tools,Sports & Outdoors,t-v84j50g0_sports-outdoors,TrailBlazer Multi-Tool 12-in-1 with Nylon Sheath,3499,TrailBlazer,"A versatile, durable multi-tool perfect for any outdoor adventure or simple home use.",TB-MT121-NS,ai,1,0,2025-12-07 13:52:57.551,,https://nbwsiobosqawrugnqddo.supabase.co/storage/v1/object/public/photos/t-v84j50g0/products/i-1mgurziw/original-1765115653914.jpg,https://nbwsiobosqawrugnqddo.supabase.co/storage/v1/object/public/photos/t-v84j50g0/products/i-1mgurziw/thumb-1765115653914.jpg,1024,1024,177754,"The TrailBlazer Multi-Tool 12-in-1 is the ultimate companion for any outdoor enthusiast or handyman. Designed to be compact yet fully functional, this multi-tool integrates 12 essential tools in one robust, easy-to-carry package. Whether you're camping, hiking, fishing, or simply tackling a DIY project at home, the TrailBlazer Multi-Tool is engineered to handle a wide range of tasks with ease. Featuring a sleek stainless steel construction and coming with a durable nylon sheath, it's designed to withstand the rigors of outdoor use while being convenient to carry on your belt or in your pack. From pliers to screwdrivers, a knife, and a bottle opener, this multi-tool has got you covered for any situation.","[""Includes 12 essential tools: pliers, wire cutter, knife, saw, bottle opener, can opener, screwdrivers, and more."", ""Compact design with a durable stainless steel construction."", ""Comes with a nylon sheath for easy carrying and protection."", ""Ergonomic handles for comfort and secure grip during use."", ""Ideal for camping, hiking, fishing, and home DIY projects.""]","{""tools"": ""12"", ""weight"": ""9.7 ounces"", ""quantity"": ""1"", ""materials"": ""Stainless steel, Nylon sheath"", ""dimensions"": ""4 inches (closed length)""}",t,standard
i-xic0ouyz,hardware_tools,Toys & Games,t-v84j50g0_toys-games,Constructo Junior Carpenter Toolkit - 15 Piece Set,2999,KidCraftTools,"Perfect starter toolkit for the young carpenter in your family, featuring real tools designed for small hands.",KC-CTK-152022,ai,1,0,2025-12-07 13:53:09.399,,https://nbwsiobosqawrugnqddo.supabase.co/storage/v1/object/public/photos/t-v84j50g0/products/i-m2vdcd6r/original-1765115672277.jpg,https://nbwsiobosqawrugnqddo.supabase.co/storage/v1/object/public/photos/t-v84j50g0/products/i-m2vdcd6r/thumb-1765115672277.jpg,1024,1024,241238,"Introduce your child to the joys of woodworking with the Constructo Junior Carpenter Toolkit, a 15-piece set designed specifically for kids. This premier toolkit includes real, functional tools that are sized perfectly for young hands, encouraging safety, creativity, and fine motor skill development. From sawing to measuring and hammering, this kit covers all the basics of carpentry, providing a hands-on learning experience that blends fun with education. The set comes in a durable, child-friendly case, making it easy to keep all tools organized and portable for projects around the house or at a friend's. With the Constructo Junior Carpenter Toolkit, you're not just giving a gift; you're sparking imagination, building confidence, and laying the foundation for lifelong skills.","[""Real, functional tools sized for young carpenters"", ""Includes hammer, saw, tape measure, level, screwdrivers, and more"", ""Durable, child-friendly storage case for easy organization and portability"", ""Encourages creativity, fine motor skills, and an understanding of basic carpentry"", ""Safe design tailored for children, with smooth edges and non-toxic finishes""]","{""size"": ""15 Piece Set"", ""material"": ""Metal tools with plastic handles"", ""quantity"": 1, ""safety_standards"": ""Meets all ASTM safety standards"", ""age_recommendation"": ""Ages 6+""}",t,standard
sid-norx14bg,electronics,Smart Home,chain_location_1766069987995_0_smart-home,iRobot Roomba 694 Robot Vacuum-Wi-Fi Connectivity,27499,iRobot,Robot vacuum with Wi-Fi connectivity and an adaptive navigation system.,IROBOT-694,ai,1,0,2025-12-18 15:05:55.495,,,,,,,"Clean your home smarter with the iRobot Roomba 694 Robot Vacuum. Designed with your convenience in mind, this vacuum connects to Wi-Fi for smart operation using the iRobot HOME App, Google Assistant, or Alexa. The 3-Stage Cleaning System and Dual Multi-Surface Brushes grab dirt from carpets and hard floors while an Edge-Sweeping brush takes care of corners and edges. Adaptive navigation helps Roomba 694 avoid obstacles and stairs, and Dirt Detect™ Technology focuses cleaning where it's needed most, making your floors get the attention they deserve without the effort from you.","[""Wi-Fi connectivity for app and voice control"", ""3-Stage Cleaning System for thorough cleaning"", ""Adaptive navigation avoids obstacles"", ""Dirt Detect™ Technology focuses on high-traffic areas"", ""Compatible with Google Assistant and Alexa""]","{""color"": ""Charcoal"", ""weight"": ""6.8 pounds"", ""dimensions"": ""13.4 x 13.4 x 3.54 inches"", ""connectivity"": ""Wi-Fi""}",f,
sid-767bs64m,electronics,Smart Home,chain_location_1766069987995_0_smart-home,TP-Link Kasa Smart Wi-Fi Plug Mini (HS105),2299,TP-Link,Compact Wi-Fi smart plug that allows control of your devices from anywhere.,TPLINK-HS105,ai,1,0,2025-12-18 15:05:55.669,,,,,,,"Turn your home into a smart home with the TP-Link Kasa Smart Wi-Fi Plug Mini. Easily manage your devices remotely through the Kasa Smart app or use simple voice commands with Alexa, Google Assistant, or Microsoft Cortana. Set schedules to automatically turn on and off your appliances, or use Away Mode to make it look like you're home when you're not. Its compact design keeps your second outlet free. Setting up is easy and does not require a hub. Experience the convenience of a smarter home with the Kasa Smart Wi-Fi Plug Mini.","[""Remote control of devices via Kasa app"", ""Voice control with Alexa, Google Assistant, and Cortana"", ""Compact design keeps second outlet free"", ""No hub required for setup"", ""Set schedules and away mode for added security""]","{""color"": ""White"", ""weight"": ""3.2 oz"", ""dimensions"": ""2.6 x 1.5 x 1.6 inches"", ""connectivity"": ""Wi-Fi""}",f,
i-8fsd44d2,grocery,Meat & Seafood,t-m11e6ur7_meat-seafood,Wild-Caught Alaskan Sockeye Salmon Fillets 2lbs,3199,Ocean's Bounty,Rich and flavorful wild-caught sockeye salmon from Alaska's pristine waters.,WCSF-2002,ai,1,0,2025-12-08 22:18:44.205,,https://nbwsiobosqawrugnqddo.supabase.co/storage/v1/object/public/photos/t-m11e6ur7/products/i-w0wexk0e/original-1765232675347.jpg,https://nbwsiobosqawrugnqddo.supabase.co/storage/v1/object/public/photos/t-m11e6ur7/products/i-w0wexk0e/thumb-1765232675347.jpg,1024,1024,126363,"Ocean's Bounty is proud to offer Wild-Caught Alaskan Sockeye Salmon Fillets, a true delicacy for seafood lovers. Harvested from the cold, clean waters of Alaska, our sockeye salmon is renowned for its deep red color, rich flavor, and high omega-3 content. Each fillet is carefully selected and hand-prepared to ensure the finest quality. Perfect for grilling, baking, or broiling, our sockeye salmon provides a heart-healthy option that is both delicious and nutritious. Embrace the taste of the wild with our sustainably sourced salmon, a testament to our commitment to the environment and your health.","[""Wild-caught in Alaska"", ""Rich in Omega-3 fatty acids"", ""No artificial preservatives"", ""Sustainably sourced"", ""Ready to cook""]","{""size"": ""2lbs"", ""quantity"": ""2 fillets"", ""ingredients"": ""Wild sockeye salmon"", ""certifications"": [""Wild-Caught""]}",t,standard
i-nyjjbpi4,electronics,Accessories,t-v84j50g0_accessories,Anker PowerCore 10000 Portable Charger,2499,Anker,A compact and lightweight external battery that provides high-speed charging.,ANK-PC10000-01,ai,1,0,2025-12-07 13:56:57.489,,,,,,,"The Anker PowerCore 10000 Portable Charger is an essential accessory for anybody who finds themselves frequently away from power outlets and in need of extra battery life for their devices. This highly compact charger is smaller than a deck of cards and as light as a baseball, but packs a powerful punch to ensure your devices stay charged. Utilizing Anker's exclusive PowerIQ and VoltageBoost technologies, it delivers the fastest possible charge to almost any smartphone, tablet, or other USB device. The PowerCore 10000 is also equipped with MultiProtect Safety System, ensuring complete protection for you and your devices.","[""Ultra-Compact: Remarkably small, tubular design slides easily next to your phone in any pocket or bag."", ""High-Speed Charging: PowerIQ and VoltageBoost combine to provide the fastest possible charge."", ""Massive Capacity: Charges the iPhone 8 almost three and a half times, the Galaxy S8 twice, and most tablets at least once."", ""Certified Safe: Anker's MultiProtect safety system ensures complete protection for you and your devices.""]","{""size"": ""92 x 60 x 22mm"", ""input"": ""Micro USB 5V/2A"", ""output"": ""USB 5V/2.4A"", ""weight"": ""180g"", ""capacity"": ""10000mAh""}",f,
i-izsp2t0t,electronics,Audio,t-v84j50g0_audio,Bose SoundLink Color Bluetooth Speaker II - Soft Black,12900,Bose,"A portable Bluetooth speaker offering bold sound and a rugged, water-resistant design.",BOS-SLII-BK,ai,1,0,2025-12-07 13:57:08.616,,,,,,,"The Bose SoundLink Color Bluetooth Speaker II is the perfect audio companion for all your adventures. With its innovative Bose technology, this portable speaker delivers bold, clear sound that really packs a punch, making every note of your music resonate beautifully. Designed for easy transport, its rugged, soft-touch silicone exterior ensures it can handle an active lifestyle, while the built-in microphone allows you to take calls or access your phone’s voice assistant directly from the speaker. The water-resistant IPX4 rating means you can enjoy your favorite tunes by the pool or park without worry. With 8 hours of battery life, the SoundLink Color II keeps the party going all day long.","[""Innovative Bose technology packs bold sound into a small, water-resistant speaker."", ""Built-in microphone for taking calls and accessing your phone's voice assistant."", ""Rugged, with a soft-touch silicone exterior that makes it easy to pick up and go."", ""Voice prompts talk you through Bluetooth pairing, making it simple to use."", ""Lithium-ion battery lets you enjoy up to 8 hours of playtime.""]","{""color"": ""Soft Black"", ""weight"": ""1.2 lbs"", ""dimensions"": ""2.2 x 5 x 5.2 inches"", ""batteryLife"": ""8 hours"", ""chargingTime"": ""3 hours"", ""connectivity"": ""Bluetooth"", ""waterResistance"": ""IPX4""}",f,
i-d2p7r0dy,electronics,Smart Home,t-v84j50g0_smart-home,"Philips Hue White and Color Ambiance A19 LED Smart Bulb, 3-Pack",13499,Philips,A smart LED bulb that offers 16 million colors and adjustable white light.,PH-A19-3PC-16M,ai,1,0,2025-12-07 13:57:24.968,,,,,,,"Experience light for your moments and ambiance from warm white to cool daylight with Philips Hue White and Color Ambiance A19 LED Smart Bulbs. Enhance your home with 16 million colors, instantly creating the right atmosphere for any event. With the touch of a button, you can set a festive mood for a party, turn the lights down for a romantic dinner, or schedule light settings to help you wake up more naturally. Compatible with Amazon Alexa, Google Assistant, and Apple HomeKit, you can control your lights with your voice, making it easier than ever to manage your home’s lighting.","[""Choose from 16 million colors and shades of white to instantly change the look and atmosphere of your room."", ""Control lights with your voice using Alexa, Google Assistant, and Apple HomeKit."", ""Set schedules, timers, and custom light scenes to match your lifestyle."", ""Easy to install and energy-efficient, reducing your energy bills."", ""Expand your smart lighting system with Philips Hue accessories (sold separately).""]","{""fitting"": ""A19"", ""lifetime"": ""25000 hours"", ""quantity"": ""3-Pack"", ""luminous_flux"": ""800 lumens"", ""color_temperature"": ""2200K-6500K"", ""energy_efficiency_class"": ""A+""}",f,
sid-w261njt3,pharmacy,Baby Care,t-ccu0mh28_baby-care,"GentleCare Hypoallergenic Baby Wipes, 80 Count",499,GentleCare,Soft and gentle hypoallergenic baby wipes for sensitive skin.,GC-BW-80CT,ai,4,0,2025-12-14 12:17:27.981,2026-04-02 07:22:23.287,https://nbwsiobosqawrugnqddo.supabase.co/storage/v1/object/public/photos/t-ccu0mh28/products/sid-lm1jpw23/original-1765714753660.jpg,https://nbwsiobosqawrugnqddo.supabase.co/storage/v1/object/public/photos/t-ccu0mh28/products/sid-lm1jpw23/thumb-1765714753660.jpg,1024,1024,92194,"GentleCare Hypoallergenic Baby Wipes are designed with your baby's delicate skin in mind. These wipes are made from soft, non-woven fabric that cleans effectively while being gentle on the skin. Perfect for newborns, infants, and toddlers, our wipes are hypoallergenic and free from alcohol, parabens, and fragrances, ensuring a safe and gentle cleanse every time. The convenient 80-count pack is perfect for home use or on-the-go, ensuring you're always ready for diaper changes, clean-ups, and more. With GentleCare, you can trust that you're giving your baby the gentlest care possible.

Our baby wipes are thoroughly tested and developed with pediatricians and dermatologists to ensure they meet the highest standards of safety and care. The unique formula is enriched with soothing aloe and vitamin E to help protect and nourish your baby's skin, while the strong and durable texture ensures a single wipe is enough, reducing waste and saving you time. GentleCare wipes are also environmentally friendly, made with biodegradable materials that are kind to the planet. Choose GentleCare Hypoallergenic Baby Wipes for a gentle, effective, and eco-conscious choice in baby care.","[""Hypoallergenic and free from alcohol, parabens, and fragrances"", ""Enriched with soothing aloe and vitamin E"", ""Strong and durable, yet soft and gentle on the skin"", ""Biodegradable materials for an eco-conscious choice"", ""Convenient 80-count pack for home or on-the-go""]","{""size"": ""80 count"", ""dimensions"": ""7.9 x 4.7 x 1.6 inches"", ""ingredients"": ""Water, Aloe Barbadensis Leaf Juice, Tocopheryl Acetate (Vitamin E), Sodium Benzoate"", ""packageType"": ""Resealable pack"", ""suitableForAges"": ""Newborn and up""}",t,standard
sid-5lqsfi6l,pharmacy,Eye & Ear Care,tid-zcp9a56y_eye-ear-care,Eye & Ear Care Item 1,999,Generic,Quality eye & ear care product for everyday use.,,ai,1,0,2026-04-02 07:22:24.761,,,,,,,,,,f,
sid-skfkf2zx,pharmacy,Eye & Ear Care,tid-zcp9a56y_eye-ear-care,Eye & Ear Care Item 2,1499,Generic,Premium eye & ear care product with enhanced features.,,ai,1,0,2026-04-02 07:22:24.934,,,,,,,,,,f,
sid-hxkm9z4g,electronics,Tablets,chain_location_1766071991129_0_tablets,Tablets Item 2,1499,Generic,Premium tablets product with enhanced features.,,ai,1,0,2025-12-18 15:38:04.986,,,,,,,,,,f,
sid-i46lnylh,electronics,Tablets,chain_location_1766071991129_0_tablets,Tablets Item 3,1999,Generic,Professional-grade tablets product.,,ai,1,0,2025-12-18 15:38:05.161,,,,,,,,,,f,
sid-pbl8anye,electronics,Tablets,chain_location_1766071991129_0_tablets,Tablets Item 4,2499,Generic,Deluxe tablets product for discerning customers.,,ai,1,0,2025-12-18 15:38:05.339,,,,,,,,,,f,
sid-cfrhpk3s,electronics,Tablets,chain_location_1766071991129_0_tablets,Tablets Item 5,2999,Generic,Top-tier tablets product with all the bells and whistles.,,ai,1,0,2025-12-18 15:38:05.513,,,,,,,,,,f,
sid-btynp2ut,electronics,Accessories,chain_location_1766071991129_0_accessories,UltraSlim USB-C Hub 4 Ports,2499,Anker,Expand your laptop's connectivity with this ultra-slim USB-C hub featuring 4 extra ports.,ANK-USBHUB-4P,ai,1,0,2025-12-18 15:38:56.41,,,,,,,"The Anker UltraSlim USB-C Hub 4 Ports is the perfect companion for the modern laptop user. With its sleek, compact design, it's the ideal solution for expanding your device's connectivity on the go. This hub turns a single USB-C port into four additional ports (2 USB-A and 2 USB-C), allowing you to connect a variety of devices at once. Whether you're at the office, working from home, or traveling, this USB-C hub helps you stay connected and productive. Its durable build ensures it can handle the rigors of everyday use, making it a reliable addition to your tech toolkit.","[""Ultra-slim and portable design"", ""2 USB-A and 2 USB-C ports for versatile connectivity"", ""Plug and play, no drivers required"", ""High-speed data transfer up to 5Gbps"", ""Compatible with all USB-C devices""]","{""color"": ""Space Gray"", ""ports"": ""2 USB-A, 2 USB-C"", ""weight"": ""2.08 ounces"", ""material"": ""Aluminum alloy"", ""dimensions"": ""4.5 x 1.2 x 0.5 inches""}",f,
