id,business_type,category_name,google_category_id,product_name,price_cents,brand,description,sku_pattern,generation_source,usage_count,quality_score,created_at,last_used_at,image_url,thumbnail_url,image_width,image_height,image_bytes,enhanced_description,features,specifications,has_image,image_quality
sid-eov0peaf,electronics,Smartphones,chain_location_1766069987995_0_smartphones,Google Pixel 6a 128GB,44999,Google,The Google Pixel 6a offers Google's innovative AI and software with a powerful camera and long-lasting battery life.,GP-6A-128GB,ai,2,0,2025-12-18 15:00:28.014,2025-12-18 15:33:53.647,,,,,,"Meet the Google Pixel 6a, the smartphone that brings the best of Google in a sleek, affordable package. This device features a 6.1-inch OLED display, offering beautiful visuals and a compact design. The Google Tensor processor powers it, delivering intelligent AI and machine learning capabilities for a smoother, smarter user experience. The Pixel 6a's camera system, with its 12.2MP dual rear cameras, captures vivid photos with astonishing detail, and the Magic Eraser feature allows you to remove unwanted elements from your photos with ease. Add to that a battery that lasts over 24 hours, and you have a phone that keeps up with you all day.","[""6.1-inch OLED display"", ""Google Tensor processor for AI and machine learning"", ""12.2MP dual rear camera system with Magic Eraser"", ""All-day battery life"", ""Titan M2 security chip for enhanced protection""]","{""camera"": ""12.2MP Dual Rear"", ""battery"": ""24+ hours"", ""display"": ""6.1-inch OLED"", ""storage"": ""128GB"", ""processor"": ""Google Tensor""}",f,
sid-g6nxjuym,electronics,Smartphones,chain_location_1766069987995_0_smartphones,OnePlus 9 Pro 256GB,79999,OnePlus,"The OnePlus 9 Pro offers a smooth 120Hz Fluid Display, Hasselblad camera system, and fast charging capabilities.",OP9P-256GB,ai,2,0,2025-12-18 15:00:28.198,2025-12-18 15:33:53.833,,,,,,"The OnePlus 9 Pro 256GB is a masterpiece of smartphone technology, designed for those who refuse to compromise on performance. Featuring a 6.7-inch Fluid AMOLED display with LTPO technology, it delivers a seamless 120Hz refresh rate that adjusts to your content for an ultra-smooth viewing experience. The Hasselblad camera partnership brings unparalleled color accuracy and image quality to your photos and videos. Powered by the Snapdragon 888 processor and supporting Warp Charge 65T and wireless charging, the OnePlus 9 Pro is built for speed, enabling you to do more in less time. Its OxygenOS provides a fast, smooth, and efficient user experience that is uniquely OnePlus.","[""6.7-inch Fluid AMOLED display with 120Hz refresh rate"", ""Hasselblad camera for superior image quality"", ""Snapdragon 888 processor for ultimate performance"", ""Warp Charge 65T and wireless charging"", ""OxygenOS for a smooth software experience""]","{""camera"": ""Hasselblad Camera System"", ""battery"": ""Warp Charge 65T"", ""display"": ""6.7-inch Fluid AMOLED"", ""storage"": ""256GB"", ""processor"": ""Snapdragon 888""}",f,
sid-g58y0rxl,electronics,Smartphones,chain_location_1766071991129_0_smartphones,Moto G Power (2021) 64GB,24999,Motorola,Budget-friendly smartphone with 3-day battery life.,MGPOWER-64GB-2021,ai,1,0,2025-12-18 15:33:54.01,,,,,,,"The Moto G Power (2021) is designed for those who prioritize battery life and affordability. Featuring a massive 5000mAh battery, this phone can last up to three days on a single charge, ensuring you stay connected when it matters most. The 6.6-inch Max Vision HD+ display offers a wide viewing area for movies, games, and video calls. With a Snapdragon 662 processor and 4GB of RAM, the Moto G Power delivers reliable performance for everyday tasks. It also includes a versatile triple camera system for capturing life's moments in clear detail. The 64GB of internal storage, expandable via microSD, provides plenty of room for your apps and media.","[""6.6-inch Max Vision HD+ display"", ""5000mAh battery"", ""Snapdragon 662 processor"", ""Triple camera system"", ""64GB expandable storage""]","{""camera"": ""48MP main"", ""battery"": ""5000mAh"", ""display"": ""6.6-inch"", ""storage"": ""64GB"", ""processor"": ""Snapdragon 662""}",f,
sid-7b3bzc6l,electronics,Laptops,chain_location_1766071991129_0_laptops,Laptops Item 1,999,Generic,Quality laptops product for everyday use.,,ai,1,0,2025-12-18 15:36:04.733,,,,,,,,,,f,
sid-32roth9m,electronics,Laptops,chain_location_1766071991129_0_laptops,Laptops Item 2,1499,Generic,Premium laptops product with enhanced features.,,ai,1,0,2025-12-18 15:36:04.951,,,,,,,,,,f,
sid-xro1tewa,electronics,Laptops,chain_location_1766071991129_0_laptops,Laptops Item 3,1999,Generic,Professional-grade laptops product.,,ai,1,0,2025-12-18 15:36:05.126,,,,,,,,,,f,
sid-mby8uu2g,electronics,Laptops,chain_location_1766071991129_0_laptops,Laptops Item 4,2499,Generic,Deluxe laptops product for discerning customers.,,ai,1,0,2025-12-18 15:36:05.303,,,,,,,,,,f,
sid-pyjc9bln,electronics,Laptops,chain_location_1766071991129_0_laptops,Laptops Item 5,2999,Generic,Top-tier laptops product with all the bells and whistles.,,ai,1,0,2025-12-18 15:36:05.479,,,,,,,,,,f,
sid-pgmpgu36,electronics,Tablets,chain_location_1766071991129_0_tablets,Tablets Item 1,999,Generic,Quality tablets product for everyday use.,,ai,1,0,2025-12-18 15:38:04.771,,,,,,,,,,f,
sid-erme7vg6,pet_supplies,Cat Food & Treats,tid-c2r2kf8v_cat-food-treats,"Green Gardens Grain-Free Cat Kibble - Salmon Recipe, 5 lbs",2399,Blue Buffalo,"A grain-free, salmon recipe dry cat food designed for adult cats.",BB-GGSK5-2399,ai,1,0,2025-12-23 22:41:34.431,,https://nbwsiobosqawrugnqddo.supabase.co/storage/v1/object/public/photos/tid-c2r2kf8v/products/sid-rf0tk52j/original-1766529852016.jpg,https://nbwsiobosqawrugnqddo.supabase.co/storage/v1/object/public/photos/tid-c2r2kf8v/products/sid-rf0tk52j/thumb-1766529852016.jpg,1024,1024,126369,"Unlock your cat's potential for a healthy and vibrant lifestyle with Green Gardens Grain-Free Cat Kibble - Salmon Recipe, proudly presented by Blue Buffalo. This 5 lb bag of premium dry cat food is crafted with the finest natural ingredients, including real salmon as the first ingredient, providing your cat with high-quality protein for muscle maintenance. Formulated without grains, gluten, or wheat, this recipe is ideal for cats with sensitivities or dietary restrictions. Rich in omega fatty acids for skin and coat health, antioxidants for immune system support, and equipped with Blue Buffalo's exclusive LifeSource Bits for a precise blend of vitamins, minerals, and antioxidants, this is more than just food—it's a pathway to your cat's well-being.","[""High-quality salmon as the first ingredient"", ""Grain-free and gluten-free for cats with sensitive stomachs"", ""Contains omega fatty acids for healthy skin and coat"", ""Includes LifeSource Bits for a precise blend of nutrients""]","{""size"": ""5 lbs"", ""quantity"": ""1 bag"", ""lifeStage"": ""Adult"", ""ingredients"": [""Salmon, chicken meal, pea protein, tapioca starch, menhaden fish meal""]}",t,standard
sid-q3zd76o9,electronics,Accessories,chain_location_1766071991129_0_accessories,Wireless Charging Stand - 10W,1999,Belkin,"Fast wireless charging stand designed for convenience and speed, compatible with all Qi-enabled devices.",BLK-WCS10W,ai,1,0,2025-12-18 15:38:57.123,,,,,,,"The Belkin Wireless Charging Stand is a sleek and convenient solution to charge your Qi-enabled devices without the hassle of cords. With a 10W output, it provides fast charging for devices such as iPhones, Samsung Galaxy, and more. The stand design allows you to place your device in landscape or portrait mode, making it perfect for video calls, watching movies, or checking messages while charging. Its anti-slip surface ensures your phone stays securely in place. The LED indicator confirms your device is charging properly. Experience the future of charging with Belkin's reliable and stylish wireless charging stand.","[""10W fast wireless charging"", ""Compatible with all Qi-enabled devices"", ""Dual orientation: landscape or portrait mode"", ""Anti-slip surface and LED charging indicator"", ""Sleek and stylish design""]","{""output"": ""10W"", ""weight"": ""3.52 ounces"", ""material"": ""Plastic"", ""dimensions"": ""4.7 x 3.9 x 3.9 inches"", ""compatibility"": ""Qi-enabled devices""}",f,
sid-g6i0kgg1,electronics,Accessories,chain_location_1766071991129_0_accessories,Bluetooth 5.0 Earbuds with Charging Case,4999,JBL,High-quality wireless earbuds with long-lasting battery life and a compact charging case.,JBL-BT5EB-CC,ai,1,0,2025-12-18 15:38:57.311,,,,,,,"Experience the freedom of true wireless audio with the JBL Bluetooth 5.0 Earbuds. These earbuds offer exceptional sound quality, clarity, and bass, all without the restrictions of cables. Bluetooth 5.0 technology ensures a stable and fast connection to your devices. With up to 5 hours of playback time and an additional 15 hours with the compact charging case, your music can go wherever you go. The earbuds are designed for comfort and secure fit, making them perfect for workouts, commuting, or casual listening. Effortlessly take calls or control your music with touch-sensitive controls. The JBL Bluetooth Earbuds redefine what you can expect from wireless audio.","[""High-quality sound with deep bass"", ""Bluetooth 5.0 for stable connection"", ""20 hours combined playback time"", ""Touch-sensitive controls"", ""Compact and portable charging case""]","{""color"": ""Black"", ""weight"": ""1.6 ounces (earbuds), 2.4 ounces (case)"", ""battery_life"": ""5 hours (earbuds), 15 hours (case)"", ""compatibility"": ""Bluetooth compatible devices"", ""bluetooth_version"": ""5.0""}",f,
sid-pkqrlqgt,electronics,Accessories,chain_location_1766071991129_0_accessories,USB-C to HDMI Adapter,2199,Cable Matters,Connect your USB-C enabled device to an HDMI display with this high-quality adapter.,CBLM-UC2HDMI,ai,1,0,2025-12-18 15:38:57.497,,,,,,,"The Cable Matters USB-C to HDMI Adapter is an indispensable companion for your USB-C equipped laptop, tablet, or phone. This adapter allows you to mirror or extend your display to an HDMI-equipped monitor or TV at up to 4K resolution, making it perfect for presentations, movie nights, or extending your workspace. With its plug-and-play design, there's no need for drivers or external power, making it a convenient and portable solution for all your display needs. The adapter supports both video and audio transfer, providing a seamless and immersive viewing experience. Its durable construction ensures longevity, making it a reliable choice for professionals and entertainment enthusiasts alike.","[""Supports up to 4K resolution"", ""Plug and play, no drivers needed"", ""Video and audio transfer"", ""Durable and portable design"", ""Compatible with USB-C devices""]","{""output"": ""HDMI"", ""weight"": ""1.76 ounces"", ""dimensions"": ""8.7 x 0.5 x 0.2 inches"", ""resolution"": ""Up to 4K"", ""compatibility"": ""USB-C devices""}",f,
sid-y5904b22,electronics,Accessories,chain_location_1766071991129_0_accessories,Portable External SSD - 1TB,10999,Samsung,"Lightweight and compact external SSD with 1TB capacity, offering fast data transfer speeds.",SAMS-EXTSSD-1TB,ai,1,0,2025-12-18 15:38:57.681,,,,,,,"Elevate your data storage with the Samsung Portable External SSD 1TB. This compact and lightweight SSD delivers lightning-fast data transfer speeds, making it perfect for transferring large files, backing up photos, videos, and documents, or expanding your device's storage capacity. With its rugged construction, it's resistant to shocks, drops, and vibrations, ensuring your data is secure even on the go. The USB-C connectivity offers universal compatibility and easy plug-and-play with PCs, Macs, smartphones, and other devices. Its sleek design is not only aesthetically pleasing but also practical, fitting easily into pockets and bags. Transform your data storage and transfer experience with this powerful external SSD.","[""1TB storage capacity"", ""Lightning-fast data transfer"", ""Shock-resistant design"", ""USB-C connectivity for universal compatibility"", ""Compact and lightweight""]","{""weight"": ""1.8 ounces"", ""capacity"": ""1TB"", ""material"": ""Aluminum"", ""dimensions"": ""3.3 x 2.2 x 0.3 inches"", ""connectivity"": ""USB-C""}",f,
sid-f9qcd3vb,electronics,Smart Home,chain_location_1766069987995_0_smart-home,Philips Hue White and Color Ambiance A19 60W Equivalent Smart Bulb Starter Kit (4 Bulbs and 1 Hub),19999,Philips,Smart bulb starter kit that offers millions of shades of white and color light.,PHUE-A19-4KIT,ai,2,0,2025-12-18 15:05:55.134,2025-12-18 15:41:52.296,,,,,,"Transform your home with over 16 million colors and shades of white light. Sync your smart lights to your music, TV, and games for an immersive effect. The Philips Hue White and Color Ambiance A19 60W Equivalent Smart Bulb Starter Kit comes with four bulbs and a hub to connect them to other smart home devices. These smart bulbs can wake you up and help you sleep with light schedules. Philips Hue works with Amazon Alexa and the Google Assistant when paired with a compatible Google Nest or Amazon Echo device, providing hands-free voice control of your lights.","[""16 million colors and shades of white"", ""Sync with music, TV, and games for immersive effects"", ""Control lights with your voice"", ""Set light schedules for easy home automation"", ""Energy-efficient LED technology""]","{""color"": ""Multicolor"", ""weight"": ""2.2 oz each bulb"", ""quantity"": ""4 bulbs + 1 hub"", ""dimensions"": ""2.4 x 4.3 in"", ""connectivity"": ""Zigbee and Bluetooth""}",f,
sid-qgzjcvfc,electronics,Smart Home,chain_location_1766071991129_0_smart-home,Nest Thermostat E,16999,Google Nest,A smart thermostat with a simple design and new frosted display.,NEST-THRMST-E,ai,1,0,2025-12-18 15:41:52.497,,,,,,,"The Google Nest Thermostat E is designed to go unnoticed. Its simple design and new frosted display blend into the background. With smart features to control your home's temperature from anywhere, the Nest Thermostat E learns your schedule and the temperatures you like. It turns itself down when you leave, so you don’t waste energy heating or cooling an empty home. Installation is easy, you can do it yourself in about 30 minutes.

Using the Nest app, you can change the temperature from anywhere – the office, the beach, or your bed. And with its proven energy-saving features, the Nest Thermostat E can pay for itself in no time. Plus, you can check your energy history to see how much you’ve saved.","[""Frosted display blends into the background"", ""Turns itself down when you leave"", ""Control from anywhere"", ""Easy installation""]","{""weight"": ""1 pound"", ""battery"": ""2-year battery life"", ""dimensions"": ""3.19 x 3.19 x 1.14 inches"", ""connectivity"": ""Wi-Fi""}",f,
sid-1hpraiiv,electronics,Smart Home,chain_location_1766071991129_0_smart-home,Ring Video Doorbell 3,19999,Ring,"Enhanced Wi-Fi, improved motion detection, and more privacy controls.",RING-VD-DOORBELL3,ai,1,0,2025-12-18 15:41:52.68,,,,,,,"The Ring Video Doorbell 3 is the latest version of Ring’s flagship video doorbell. With enhanced Wi-Fi connectivity, improved motion detection, and added privacy controls, it’s never been easier to secure and monitor your home. See, hear, and speak to visitors from anywhere with live view on-demand video and audio. Get mobile notifications when anyone presses your doorbell or triggers your built-in motion sensors.

Easily set up by connecting your Ring Video Doorbell 3 to wifi through the Ring app and mounting it with the included tools. With a Ring Protect Plan (subscription sold separately), record all your videos to review what you missed for up to 60 days, and share videos and photos.","[""1080p HD video with two-way talk"", ""Advanced motion settings"", ""Dual-band Wi-Fi connectivity"", ""Privacy settings""]","{""audio"": ""Two-way audio with noise cancellation"", ""connectivity"": ""802.11 b/g/n Wi-Fi connection @ 2.4GHz & 5GHz"", ""field of view"": ""160 degrees"", ""video resolution"": ""1080 HD""}",f,
sid-u5dhd7ck,electronics,Smart Home,chain_location_1766071991129_0_smart-home,TP-Link Kasa Smart Wi-Fi Plug Mini,2299,TP-Link,Control your outlets from anywhere with your smartphone.,TPL-KASA-MINI,ai,1,0,2025-12-18 15:41:52.869,,,,,,,"The TP-Link Kasa Smart Wi-Fi Plug Mini is an easy way to control your devices from anywhere, whether you're at home, in the office, or on vacation. This compact device allows you to turn electronics on or off from anywhere with your smartphone using the Kasa app. It supports voice control with Amazon Alexa, Google Assistant, and Microsoft Cortana for hands-free convenience.

Set schedule and timers to automate your home, such as turning on lights at dusk or turning off at sunrise. With an 'Away Mode', the Smart Wi-Fi Plug Mini helps give the appearance that someone is home by turning devices on and off at random intervals, enhancing your home security. The installation is simple and requires no extra hub or subscription service.","[""Remote control"", ""Voice control"", ""Set schedules"", ""Away mode for security""]","{""network"": ""802.11 b/g/n, 2.4 GHz, No hub required"", ""maximum load"": ""15A"", ""compatibility"": ""Android 5.0 or higher, iOS 10 or higher"", ""input voltage"": ""100-120VAC""}",f,
sid-x4zsyxs1,electronics,Smart Home,chain_location_1766071991129_0_smart-home,Arlo Pro 3 Floodlight Camera,24999,Arlo,"Wireless, 2K video quality, color night vision, and integrated spotlight.",ARLO-PRO3-FLD,ai,1,0,2025-12-18 15:41:53.052,,,,,,,"The Arlo Pro 3 Floodlight Camera is the first 100% wire-free floodlight camera, monitoring your home in super high resolution with 2K video quality. It features color night vision, an integrated spotlight, and an ultra-wide view to capture more of what matters. The powerful LEDs illuminate a wide area, activated by motion or manually, deterring unwanted guests.

Easy to install and no wires mean quick and easy installation without the need for an electrician. The Arlo Pro 3 Floodlight Camera works with Alexa, Google Assistant, and Apple HomeKit for easy voice control. The Arlo app provides remote viewing, motion detection notifications, and more, keeping you connected to your home from anywhere.","[""100% wire-free"", ""2K video with HDR"", ""Integrated spotlight and color night vision"", ""Smart home integration""]","{""resolution"": ""2560 x 1440"", ""battery life"": ""3-6 months"", ""field of view"": ""160 degrees"", ""weather resistance"": ""IP65 rating""}",f,
sid-iwspjfom,jewelry,Rings,tid-h02h6056_rings,Classic Gold Wedding Band (6mm),75000,Tiffany & Co.,"A timeless 6mm wedding band in 18k yellow gold, perfect for your special day.",TFY-2002-WB-YG,ai,1,0,2025-12-22 21:57:04.282,,,,,,,"Celebrate your everlasting love with the Classic Gold Wedding Band from Tiffany & Co., a symbol of unending commitment and style. This 6mm wedding band, crafted from the finest 18k yellow gold, offers a perfect blend of luxury and comfort. Designed for both men and women, its classic style and smooth finish embody the essence of timeless elegance. Ideal for those who favor a more traditional look, this wedding band is an exquisite choice that promises to be a treasured part of your love story. With its unmatched quality and iconic brand, this ring stands as a testament to your enduring bond.","[""Crafted from luxurious 18k yellow gold."", ""6mm band width for a substantial yet comfortable fit."", ""Smooth, polished finish for timeless elegance."", ""Suitable for both men and women."", ""Iconic brand ensuring exceptional quality.""]","{""size"": ""Available in sizes 5-12 (including half sizes)"", ""width"": ""6mm"", ""material"": ""18k yellow gold""}",f,
sid-m2u0b286,jewelry,Rings,tid-h02h6056_rings,Sterling Silver Stackable Birthstone Ring,4500,Pandora,"A customizable stackable ring crafted in sterling silver, featuring a choice of birthstones.",PND-3003-BS-SR,ai,1,0,2025-12-22 21:57:04.611,,,,,,,"The Sterling Silver Stackable Birthstone Ring from Pandora offers a personalized touch to your jewelry collection. This beautifully designed ring allows you to choose a birthstone that represents either your birth month or a loved one's, adding a meaningful and colorful accent to your ensemble. Crafted in lustrous sterling silver, its slim profile makes it perfect for stacking with other rings, allowing you to create a unique and layered look. Whether worn alone or as part of a stack, this ring is a versatile addition to any outfit, making it an ideal gift for birthdays, anniversaries, or as a treat to yourself. Embrace personalization with elegance and celebrate the moments and people that matter most.","[""Customizable with a choice of birthstones."", ""Crafted in high-quality sterling silver for durability and shine."", ""Slim design perfect for stacking."", ""Adds a meaningful and colorful accent to any outfit."", ""Ideal gift for special occasions.""]","{""size"": ""Available in sizes 4.5-9"", ""material"": ""Sterling silver"", ""stoneType"": ""Choice of birthstone""}",f,
sid-ku3dnuge,books_media,Music & Movies,t-ccu0mh28_music-movies,Inception Blu-ray,1499,Warner Bros.,"Christopher Nolan's mind-bending masterpiece, Inception, on high-definition Blu-ray.",BLU-INCEP-WB,ai,3,0,2025-12-14 12:32:56.171,2025-12-19 20:58:53.793,https://nbwsiobosqawrugnqddo.supabase.co/storage/v1/object/public/photos/t-ccu0mh28/products/sid-3h91z9vv/original-1765715762024.jpg,https://nbwsiobosqawrugnqddo.supabase.co/storage/v1/object/public/photos/t-ccu0mh28/products/sid-3h91z9vv/thumb-1765715762024.jpg,1024,1024,95146,"Dive into the dream world with Christopher Nolan's groundbreaking film, Inception, now available on high-definition Blu-ray. Released by Warner Bros., this sci-fi thriller takes you on a journey through the layers of the subconscious, featuring a star-studded cast including Leonardo DiCaprio, Joseph Gordon-Levitt, and Ellen Page. The Blu-ray edition offers unmatched picture quality and sound, bringing the film's intricate visuals and Hans Zimmer's powerful score to life in your living room. Special features include behind-the-scenes documentaries, concept art, and exclusive commentary by Nolan himself, making it an essential addition to any film aficionado's collection. Experience the gripping tale of dreams within dreams with clarity and depth like never before.","[""High-definition Blu-ray format for the best picture quality"", ""Special features including director's commentary and making-of documentaries"", ""Stellar cast led by Leonardo DiCaprio"", ""Award-winning soundtrack by Hans Zimmer"", ""Interactive menus with scene selection""]","{""format"": ""Blu-ray"", ""rating"": ""PG-13"", ""runtime"": ""148 minutes"", ""language"": ""English"", ""subtitles"": ""English, Spanish, French""}",t,standard
sid-0cshfxsa,pet_supplies,Dog Food & Treats,tid-yrkd470n_dog-food-treats,Blue Buffalo Life Protection Formula Adult Chicken & Brown Rice Recipe - 30 lb,4999,Blue Buffalo,"A high-quality dry dog food made with real meat, whole grains, and garden veggies.",BB-LPF-ACBR-30LB,ai,1,0,2025-12-18 23:07:12.855,,,,,,,"The Blue Buffalo Life Protection Formula Adult Chicken & Brown Rice Recipe is crafted to provide a balanced and nutritious diet for adult dogs. Made with high-quality protein from real chicken, it helps your dog build and maintain lean muscle. The recipe also includes wholesome whole grains, garden veggies, and fruit. It is formulated with LifeSource Bits—a precise blend of antioxidants, vitamins, and minerals carefully selected by holistic veterinarians and animal nutritionists to support immune system health, life stage requirements, and a healthy oxidative balance. This natural dog food offers a tasty and nutritious meal that’s free from chicken (or poultry) by-product meals, corn, wheat, soy, artificial flavors, and preservatives.","[""Real chicken as the first ingredient"", ""Contains wholesome whole grains, garden veggies, and fruit"", ""No chicken (or poultry) by-product meals, corn, wheat, soy, artificial flavors, or preservatives"", ""LifeSource Bits for immune system health"", ""Supports lean muscle maintenance and overall health""]","{""size"": ""30 lb"", ""quantity"": ""1 Bag"", ""breedSize"": ""All Sizes"", ""lifeStage"": ""Adult"", ""ingredients"": ""Deboned Chicken, Chicken Meal, Brown Rice, Barley, Oatmeal, Pea Starch, Flaxseed, Chicken Fat, Dried Tomato Pomace, Natural Flavor, Peas, Salt, Potassium Chloride, Fish Oil""}",f,
