id,business_type,category_name,google_category_id,product_name,price_cents,brand,description,sku_pattern,generation_source,usage_count,quality_score,created_at,last_used_at,image_url,thumbnail_url,image_width,image_height,image_bytes,enhanced_description,features,specifications,has_image,image_quality
i-xzwuuw6z,office_supplies,Sports & Outdoors,t-m11e6ur7_sports-outdoors,Eagle Peak 4-Person Dome Camping Tent,7999,Eagle Peak,A spacious and durable 4-person dome tent perfect for camping and outdoor adventures.,EPCT-400,ai,1,0,2025-12-11 04:25:17.521,,,,,,,"Introducing the Eagle Peak 4-Person Dome Camping Tent, your next outdoor adventure's perfect companion. Crafted with high-quality, durable materials, this tent offers the ideal balance of comfort and protection in the great outdoors. Its spacious interior comfortably accommodates up to four adults, making it perfect for family camping trips, festivals, or weekend getaways with friends. The tent features a waterproof design and wind-resistant frame, ensuring you stay dry and comfortable no matter the weather. With easy assembly and lightweight design, the Eagle Peak Dome Tent is ideal for both seasoned campers and those new to outdoor adventures.

The tent's enhanced ventilation system, featuring mesh windows and a large door, provides excellent airflow, reducing condensation and keeping the interior fresh. For privacy and convenience, the tent includes a room divider, allowing you to create separate sleeping and living areas. Its durable, tear-resistant fabric and strong, flexible poles guarantee long-lasting performance and reliability. Whether you're exploring the wilderness or enjoying a quiet night under the stars, the Eagle Peak 4-Person Dome Camping Tent is your go-to choice for comfortable and secure outdoor lodging.","[""Waterproof and wind-resistant design for all-weather protection"", ""Spacious interior comfortably sleeps up to 4 adults"", ""Easy assembly and lightweight design for convenient portability"", ""Enhanced ventilation system with mesh windows and large door"", ""Durable, tear-resistant fabric and strong, flexible poles for longevity""]","{""weight"": ""8 lbs"", ""capacity"": ""4 Person"", ""material"": ""Polyester"", ""dimensions"": ""9ft x 7ft x 50in"", ""waterproof"": ""Yes""}",f,
i-ztqbhqvo,office_supplies,Toys & Games,t-m11e6ur7_toys-games,Mega Builders Block Set - 100 Pieces,2499,BuildMaster,"A 100-piece set of colorful, interlocking building blocks for kids.",BM-BBS-100,ai,1,0,2025-12-11 04:27:13.895,,,,,,,"Introduce your child to the world of creativity and engineering with the Mega Builders Block Set from BuildMaster. Designed for little hands and big imaginations, this 100-piece set features brightly colored blocks that easily interlock to form stable structures, ranging from simple designs for beginners to complex creations for advanced builders. Each block is made from durable, non-toxic plastic, ensuring safe play for children ages 3 and up. Encourage your child's developmental skills, such as fine motor skills, spatial reasoning, and problem-solving, while providing hours of entertainment. The BuildMaster Mega Builders Block Set is the perfect gift for budding engineers and imaginative minds.","[""100 vibrantly colored interlocking blocks"", ""Durable, non-toxic plastic construction"", ""Encourages fine motor skills and creativity"", ""Suitable for children ages 3+"", ""Easy storage with the included box""]","{""color"": ""Multi-color"", ""material"": ""Plastic"", ""quantity"": ""100 pieces"", ""age_range"": ""3+""}",f,
i-cpic5lm2,office_supplies,Office Supplies,t-m11e6ur7_office-supplies,ErgoComfort Adjustable Mesh Office Chair,8999,ComfortSeating,A high-back ergonomic office chair with adjustable lumbar support and breathable mesh.,COMF-EMOC-8210,ai,1,0,2025-12-11 04:31:16.767,,,,,,,"Introducing the ErgoComfort Adjustable Mesh Office Chair by ComfortSeating, designed to offer unparalleled support and comfort throughout your workday. Featuring a high-back design and built-in adjustable lumbar support, this chair is engineered to accommodate a wide range of body types and seating preferences. The breathable mesh back promotes air circulation, keeping you cool and comfortable, even during long hours of use. With easy-to-adjust height and tilt mechanisms, you can customize your seating position with precision, ensuring optimal ergonomics and reducing the risk of strain or injury. Whether you're working from home or in a traditional office setting, the ErgoComfort chair is the perfect addition to your workspace.

The robust construction and sleek design combine functionality with style, making it a fitting choice for any modern office. The chair's 5-point base with durable casters offers smooth mobility across various floor types, while the padded seat provides a soft, comfortable cushion that's perfect for extended sitting periods. Adjustable armrests further enhance comfort and support, allowing for a more relaxed and productive work experience. Upgrade your office seating with the ErgoComfort Adjustable Mesh Office Chair and transform how you work.","[""Adjustable lumbar support for personalized comfort"", ""Breathable mesh back for optimal airflow"", ""Easy-to-adjust height and tilt for ergonomic seating"", ""Durable 5-point base with smooth-rolling casters"", ""Padded seat and adjustable armrests for added comfort""]","{""color"": ""Black"", ""material"": ""Mesh, Metal, Foam"", ""dimensions"": ""25\""W x 24\""D x 45-50\""H"", ""weight_capacity"": ""250 lbs"", ""assembly_required"": ""Yes""}",f,
sid-i8f1kdvx,electronics,Accessories,chain_location_1766071991129_0_accessories,Tempered Glass Screen Protector for iPhone 12/12 Pro (2-Pack),1299,Spigen,"Premium tempered glass screen protector for iPhone 12/12 Pro, offering maximum protection.",SPG-IP12SP-2PK,ai,1,0,2025-12-18 15:38:56.929,,,,,,,"Protect your iPhone 12 or 12 Pro with Spigen's Tempered Glass Screen Protector. This pack of two ensures that your device's screen remains pristine and safe from scratches, cracks, and everyday wear and tear. The screen protector is designed with precision to provide a perfect fit, maintaining the touchscreen's responsiveness and clarity. Its 9H hardness rating guarantees the best protection against drops and bumps. The oleophobic coating also keeps fingerprints and smudges at bay, ensuring your screen is always clear. Easy to install and remove, this screen protector is a must-have accessory for your iPhone.","[""9H hardness for superior protection"", ""Oleophobic coating to reduce smudges"", ""High transparency for original viewing experience"", ""Easy, bubble-free installation"", ""Pack of 2 for added value""]","{""material"": ""Tempered glass"", ""quantity"": ""2 screen protectors per pack"", ""thickness"": ""0.33mm"", ""compatibility"": ""iPhone 12/12 Pro""}",f,
i-kbffkn8y,electronics,Laptops,t-v84j50g0_laptops,"Lenovo Ideapad Flex 5 14"" 2-in-1 Laptop",64999,Lenovo,A versatile 2-in-1 laptop with a 14-inch FHD touchscreen display and powerful performance for work and play.,LEN-IPF514-005,ai,3,0,2025-12-07 13:24:21.854,2025-12-19 20:56:24.534,https://nbwsiobosqawrugnqddo.supabase.co/storage/v1/object/public/photos/t-v84j50g0/products/i-fabn1ja8/original-1765113941201.jpg,https://nbwsiobosqawrugnqddo.supabase.co/storage/v1/object/public/photos/t-v84j50g0/products/i-fabn1ja8/thumb-1765113941201.jpg,1024,1024,114456,"Discover the perfect blend of versatility and performance with the Lenovo Ideapad Flex 5. This 14-inch 2-in-1 laptop is designed for users who desire flexibility and reliability from their computing devices. Whether you're working on demanding projects, enjoying your favorite entertainment, or just browsing the internet, the Ideapad Flex 5 meets your needs with ease. Equipped with the latest Intel processors and integrated Intel graphics, it delivers smooth, responsive performance for multitasking and media. The 360-degree hinge allows you to use it in laptop, tent, stand, or tablet mode, making it ideal for every kind of user from professionals to students.

Enjoy vibrant visuals on the FHD touchscreen display, optimized with narrow bezels for an immersive viewing experience. The included digital pen lets you sketch, jot notes, and navigate with precision, enhancing your productivity and creativity. With its sleek design, long-lasting battery life, and robust security features including a fingerprint reader, the Lenovo Ideapad Flex 5 is the smart choice for anyone who needs a reliable laptop that can keep up with their lifestyle.","[""360-degree hinge for flexible viewing modes - laptop, tent, stand, or tablet"", ""14-inch FHD touchscreen display with narrow bezels for immersive visuals"", ""Includes digital pen for precise input and creativity"", ""Powered by Intel processors with integrated Intel graphics for smooth performance"", ""Fingerprint reader for enhanced security and quick access""]","{""ports"": ""USB-C, 2x USB 3.1, HDMI, SD card reader, headphone/mic combo"", ""memory"": ""8GB DDR4"", ""weight"": ""3.63 pounds"", ""display"": ""14-inch FHD (1920 x 1080) IPS touchscreen"", ""storage"": ""512GB SSD"", ""graphics"": ""Integrated Intel Graphics"", ""processor"": ""Intel Core i5 10th Gen"", ""dimensions"": ""12.66 x 8.56 x 0.82 inches"", ""batteryLife"": ""Up to 10 hours"", ""operatingSystem"": ""Windows 10 Home""}",t,standard
i-volr1i3f,office_supplies,Paper Products,t-m11e6ur7_paper-products,"Hammermill Premium Multi-Purpose Paper, 8.5"" x 11"", 500 Sheets",899,Hammermill,"A high-quality, multi-purpose paper that runs well through electronic imaging equipment as well as conventional offset presses.",HM218500,ai,1,0,2025-12-11 04:34:45.169,,https://nbwsiobosqawrugnqddo.supabase.co/storage/v1/object/public/photos/t-m11e6ur7/products/i-gg5r1bqz/original-1765427746300.jpg,https://nbwsiobosqawrugnqddo.supabase.co/storage/v1/object/public/photos/t-m11e6ur7/products/i-gg5r1bqz/thumb-1765427746300.jpg,1024,1024,105901,"Introducing our Hammermill Premium Multi-Purpose Paper, the perfect solution for all your printing needs. Whether you're printing a high-stakes report for work, crafting detailed graphics, or simply making copies, this paper will provide crisp, clean results every time. Its 97 brightness and heavier 24 lb weight make it ideal for double-sided printing without show-through. Plus, it's sustainably sourced and made in the USA, supporting local jobs and reducing environmental impact. With a jam-free guarantee and compatibility with laser and inkjet printers, copiers, and fax machines, this paper is as reliable as it is versatile.","[""97 brightness for high-quality prints"", ""Heavier 24 lb. weight to prevent show-through"", ""Sustainably sourced to support environmental responsibility"", ""Jam-free guarantee for reliable printing"", ""Compatible with laser and inkjet printers, copiers, and fax machines""]","{""size"": ""8.5\"" x 11\"""", ""weight"": ""24 lb"", ""material"": ""Sustainably sourced paper"", ""quantity"": ""500 Sheets"", ""brightness"": ""97""}",t,standard
i-r3jvya4e,office_supplies,Filing & Organization,t-m11e6ur7_filing-organization,"Staples 3-Drawer Vertical File Cabinet, Locking, Letter, Black, 19""D",18999,Staples,A durable 3-drawer vertical file cabinet perfect for organizing important documents.,STP-28374BLK,ai,1,0,2025-12-11 04:34:54.421,,https://nbwsiobosqawrugnqddo.supabase.co/storage/v1/object/public/photos/t-m11e6ur7/products/i-p26mv87m/original-1765427761234.jpg,https://nbwsiobosqawrugnqddo.supabase.co/storage/v1/object/public/photos/t-m11e6ur7/products/i-p26mv87m/thumb-1765427761234.jpg,1024,1024,121890,"The Staples 3-Drawer Vertical File Cabinet in black is the perfect solution for your filing and organizational needs. Constructed from high-quality materials, this cabinet is designed to withstand the test of time, ensuring that your documents are kept safe, secure, and organized. Each drawer can accommodate letter-sized documents, and with its built-in lock, you can keep sensitive information safely locked away. The sleek black finish and compact design allow it to blend seamlessly into any office environment, making it an ideal choice for both home and professional settings. Whether you're storing important legal documents, personal files, or office supplies, this cabinet provides the perfect combination of accessibility and privacy.","[""3 spacious drawers for letter-sized documents"", ""Built-in lock for securing sensitive information"", ""Durable construction and sleek black finish"", ""Compact design suitable for any office environment"", ""Easy-glide drawers for convenient access""]","{""size"": ""19\""D x 14.25\""W x 35.5\""H"", ""color"": ""Black"", ""material"": ""Metal"", ""quantity"": ""1"", ""assemblyRequired"": ""No""}",t,standard
i-u8tu4ri2,office_supplies,Desk Accessories,t-m11e6ur7_desk-accessories,ErgoComfort Adjustable Laptop Stand,3499,ErgoTech,An adjustable laptop stand designed to promote better posture and reduce neck strain.,ETS-LAPSTND-3499,ai,1,0,2025-12-11 04:35:03.318,,https://nbwsiobosqawrugnqddo.supabase.co/storage/v1/object/public/photos/t-m11e6ur7/products/i-yigrw1jv/original-1765427779566.jpg,https://nbwsiobosqawrugnqddo.supabase.co/storage/v1/object/public/photos/t-m11e6ur7/products/i-yigrw1jv/thumb-1765427779566.jpg,1024,1024,112789,"Experience unparalleled comfort and convenience with the ErgoComfort Adjustable Laptop Stand by ErgoTech. Crafted for the modern professional, this laptop stand transforms any desk into an ergonomic workspace, promoting better posture and minimizing neck and eye strain. With its sleek, minimalist design, it seamlessly integrates into any office or home setting. The adjustable feature allows you to find the perfect angle and height for your working needs, ensuring comfort throughout the day. The stand's sturdy construction supports laptops of various sizes, providing a reliable and stable base for your most important work tool. Upgrade your desk setup with ErgoComfort and take the first step towards a healthier, more productive workspace.","[""Adjustable height and angle for optimal ergonomics"", ""Supports laptops up to 17 inches"", ""Sleek, minimalist design suitable for any workspace"", ""Sturdy construction ensures stability and durability"", ""Promotes better posture and reduces neck and eye strain""]","{""color"": ""Silver"", ""material"": ""High-quality aluminum"", ""dimensions"": ""10 x 9 x 2 inches (adjustable height)"", ""maxLaptopSize"": ""17 inches"", ""weightCapacity"": ""15 lbs""}",t,standard
i-mtpaxlv8,office_supplies,Writing Instruments,t-m11e6ur7_writing-instruments,"Pilot G2 Premium Gel Roller Pens, 12-Pack",1999,Pilot,"A 12-pack of smooth, retractable gel pens known for their comfortable grip and long-lasting ink.",PILOT-G2-07-BLK-12PK,ai,1,0,2025-12-11 04:34:35.699,,https://nbwsiobosqawrugnqddo.supabase.co/storage/v1/object/public/photos/t-m11e6ur7/products/i-ko16szlo/original-1765427728114.jpg,https://nbwsiobosqawrugnqddo.supabase.co/storage/v1/object/public/photos/t-m11e6ur7/products/i-ko16szlo/thumb-1765427728114.jpg,1024,1024,186957,"Experience the smooth writing of Pilot G2 Premium Gel Roller Pens, the number one selling gel ink pen in America. These pens are perfect for both professional settings and personal use, offering a superior writing experience that you can depend on. Each pen in this 12-pack features a dynamic gel ink formula that delivers smooth, skip-free writing with a comfortable rubber grip that reduces hand fatigue during long writing sessions. The retractable design not only makes it easy to use but also protects your pockets. Whether you’re taking notes, journaling, or signing documents, Pilot G2 pens ensure clarity and reliability in every stroke.","[""Dynamic Gel Ink Formula for smooth, skip-free writing"", ""Comfortable rubber grip to prevent hand fatigue"", ""Retractable and refillable for continued use"", ""Long-lasting ink supply"", ""Vivid ink colors for clear, readable text""]","{""quantity"": 12, ""tip_size"": ""0.7mm"", ""ink_color"": ""Black"", ""refillable"": true}",t,standard
i-qtm4pat3,office_supplies,Mailing & Shipping,t-m11e6ur7_mailing-shipping,"Premium Self-Sealing Bubble Mailers, Pack of 25",1499,MailSwift,"A pack of 25 high-quality, self-sealing bubble mailers perfect for secure shipping.",MS-BM-610-25,ai,1,0,2025-12-11 04:35:11.239,,https://nbwsiobosqawrugnqddo.supabase.co/storage/v1/object/public/photos/t-m11e6ur7/products/i-f73hs8y7/original-1765427797233.jpg,https://nbwsiobosqawrugnqddo.supabase.co/storage/v1/object/public/photos/t-m11e6ur7/products/i-f73hs8y7/thumb-1765427797233.jpg,1024,1024,134860,"The MailSwift Premium Self-Sealing Bubble Mailers are designed for businesses and individuals who demand both protection and efficiency in their mailing. Each mailer in this 25-pack features a durable exterior and a protective bubble-lined interior, ensuring that items are cushioned and safe from impact during transit. The self-sealing adhesive strip provides a secure closure without the need for additional tape, saving you time and supplies. The smooth surface is ideal for labels and handwriting, making your package both secure and professional. Whether you're sending documents, jewelry, or electronics, these mailers adapt to your needs, providing a lightweight yet reliable shipping solution.","[""Self-sealing adhesive strip for quick and secure closure."", ""Protective bubble lining cushions items during transit."", ""Lightweight to reduce shipping costs."", ""Smooth exterior surface ideal for labels and handwriting."", ""Comes in a pack of 25, providing great value.""]","{""color"": ""White"", ""material"": ""Polyethylene exterior, bubble interior"", ""quantity"": ""25"", ""dimensions"": ""6x10 inches""}",t,standard
i-zu7u4j2z,automotive,Motor Oil & Fluids,t-m11e6ur7_motor-oil-fluids,"Valvoline Advanced Full Synthetic SAE 0W-20 Motor Oil, 1 Quart",899,Valvoline,"A full synthetic motor oil designed to provide maximum protection against heat, wear, and deposits.",VALVSYN020-1Q,ai,1,0,2025-12-11 04:44:55.567,,https://nbwsiobosqawrugnqddo.supabase.co/storage/v1/object/public/photos/t-m11e6ur7/products/i-ep396kqp/original-1765428385018.jpg,https://nbwsiobosqawrugnqddo.supabase.co/storage/v1/object/public/photos/t-m11e6ur7/products/i-ep396kqp/thumb-1765428385018.jpg,1024,1024,117515,"Valvoline Advanced Full Synthetic SAE 0W-20 Motor Oil is engineered with cutting-edge technology to provide your engine with the highest level of protection against the rigors of heat, wear, and deposits. This motor oil is formulated with premium synthetic base stocks and advanced additive technology, meeting the demands of modern engine designs for enhanced fuel efficiency and lower emissions. Its low viscosity ensures rapid oil flow during cold starts, reducing wear. Furthermore, Valvoline's motor oil is designed to keep your engine running cleaner, longer, and more efficiently, making it an ideal choice for drivers who demand the best performance and protection. The 1-quart size is perfect for topping off your engine or completing a partial oil change.","[""Full synthetic formula provides exceptional high and low temperature protection"", ""Promotes enhanced fuel efficiency and helps reduce emissions"", ""Rapid oil flow at cold starts for reduced engine wear"", ""Keeps engine running cleaner and longer"", ""Suitable for modern engine designs""]","{""size"": ""1 Quart"", ""oilType"": ""Full Synthetic"", ""viscosity"": ""0W-20"", ""application"": ""Modern Gasoline Engines""}",t,standard
i-kivakqbw,automotive,Car Care & Cleaning,t-m11e6ur7_car-care-cleaning,Ultimate Shine Car Wax - 500ml,2499,Turtle Wax,High-gloss car wax for long-lasting shine and protection.,TW-CW-500-01,ai,1,0,2025-12-11 04:45:10.081,,https://nbwsiobosqawrugnqddo.supabase.co/storage/v1/object/public/photos/t-m11e6ur7/products/i-y68p12hc/original-1765428402818.jpg,https://nbwsiobosqawrugnqddo.supabase.co/storage/v1/object/public/photos/t-m11e6ur7/products/i-y68p12hc/thumb-1765428402818.jpg,1024,1024,75864,"Give your vehicle the shine it deserves with Turtle Wax Ultimate Shine Car Wax. This premium car wax is formulated to provide a deep, mirror-like shine that lasts. Its advanced blend of polymers, carnauba wax, and protective ingredients not only enhances your car's appearance but also provides a durable shield against the elements. Easy to apply and suitable for all paint types, Turtle Wax Ultimate Shine Car Wax is the perfect solution for maintaining your car's pristine look. With its non-greasy, quick-drying formula, you can achieve professional results in the comfort of your own driveway.","[""Long-lasting, high-gloss shine"", ""Advanced polymer and carnauba wax blend"", ""Protects against UV rays and weathering"", ""Easy to apply and quick-drying"", ""Suitable for all paint types""]","{""size"": ""500ml"", ""quantity"": ""1 Bottle"", ""ingredients"": ""Carnauba Wax, Polymers, UV Inhibitors""}",t,standard
i-v38zqqwj,automotive,Interior Accessories,t-m11e6ur7_interior-accessories,LED Car Interior Lighting Kit - 4pcs,2999,BrightDrive,A 4-piece LED lighting kit to enhance the interior ambiance of any vehicle.,BD-LCIK-004,ai,1,0,2025-12-11 04:45:27.696,,,,,,,"Transform your vehicle's interior with BrightDrive's LED Car Interior Lighting Kit. This 4-piece set is designed to add a vibrant ambiance and custom style to your car with ease. Each strip is flexible and features a strong adhesive backing for easy installation under the dashboard or seats. The lights are controlled via a remote, allowing you to switch between colors and modes to match your mood or music. With its plug-and-play setup connecting to the car's 12V outlet, enhancing your driving experience has never been easier. Whether you're looking to personalize your ride or add a touch of elegance, our LED lighting kit is the perfect solution.","[""4 flexible LED strips with adhesive backing"", ""Remote control for color and mode selection"", ""Easy plug-and-play installation"", ""Multiple colors and modes for personalization"", ""Energy-efficient and long-lasting LEDs""]","{""color"": ""Multi-color"", ""length"": ""2x 48cm, 2x 36cm strips"", ""voltage"": ""12V DC"", ""material"": ""LED, flexible PCB"", ""quantity"": ""4 strips"", ""installation"": ""Adhesive backing""}",f,
i-koejtk63,automotive,Exterior Accessories,t-m11e6ur7_exterior-accessories,"AeroTwin Windshield Wiper Blades, Set of 2",2499,Bosch,High-performance windshield wipers that ensure maximum visibility in all weather conditions.,BOS-WWB-2420-02,ai,1,0,2025-12-11 04:45:45.137,,,,,,,"Experience unmatched clarity and performance with Bosch AeroTwin Windshield Wiper Blades. Designed with precision and the latest in wiper technology, these blades offer a perfect blend of form and function. The AeroTwin series features a custom-made spring strip that optimizes contact with your windshield, providing a smooth, virtually streak-free wipe in both rain and snow conditions. Its innovative aerodynamic design reduces drag, noise, and wind lift, ensuring a quiet and efficient operation. The easy-to-install mechanism allows for a quick replacement, making Bosch AeroTwin a top choice for safety and convenience.","[""Precision-engineered for maximum contact and clear vision"", ""Aerodynamic design reduces noise and wind lift"", ""Easy-to-install with quick-clip adapter"", ""Durable construction designed to withstand harsh weather conditions"", ""Virtually streak-free performance""]","{""size"": ""24in/20in"", ""material"": ""Dual rubber technology"", ""quantity"": ""2"", ""compatibility"": ""Universal fit for most makes and models""}",f,
i-sds65btj,automotive,Exterior Accessories,t-m11e6ur7_exterior-accessories,"LED Halo Projector Headlights for Jeep Wrangler, Pair",9999,Xprite,"Upgrade your Jeep Wrangler with these sleek, energy-efficient LED projector headlights featuring a distinctive halo design.",XPRT-JP-HL-LED-07,ai,1,0,2025-12-11 04:45:45.382,,,,,,,"Light up the road ahead with Xprite's LED Halo Projector Headlights, specifically designed for Jeep Wrangler models. These headlights not only offer a modern, aggressive look but also provide superior illumination compared to traditional halogen bulbs. The built-in LED halo rings can be used as daytime running lights or turn signals, adding a unique style and enhanced safety to your vehicle. With a plug-and-play installation process, these headlights are easy to install, requiring no additional wiring or modifications. The durable polycarbonate lenses are sealed to prevent moisture and dust ingress, ensuring long-lasting performance in all weather conditions. Embrace the perfect blend of style, functionality, and durability with Xprite's LED Projector Headlights.","[""Bright LED illumination improves visibility and safety"", ""Distinctive LED halo design enhances vehicle appearance"", ""Plug-and-play installation with no additional wiring required"", ""Durable, weather-resistant construction"", ""Compatible with a wide range of Jeep Wrangler models""]","{""fitment"": ""Jeep Wrangler JK, JKU, TJ models"", ""voltage"": ""12V"", ""lightType"": ""LED"", ""lensMaterial"": ""Polycarbonate"", ""housingMaterial"": ""Durable ABS""}",f,
